{"$schema":"https://json-schema.org/draft/2020-12/schema","$id":"https://github.com/stableagent/mentor-framework/blob/main/schemas/bootstrap.schema.json","title":"Mentor Framework Bootstrap","type":"object","additionalProperties":false,"required":["repository","revision","loaded_documents","validated","selector_initialized"],"properties":{"repository":{"const":"https://github.com/stableagent/mentor-framework"},"revision":{"type":"string","minLength":1},"loaded_documents":{"type":"array","minItems":1,"items":{"type":"string"}},"validated":{"const":true},"selector_initialized":{"const":true}}}
