{"repository":"https://github.com/stableagent/mentor-framework","revision":"1.0.0","loaded_documents":["README.md","BOOTSTRAP.md","standards/context-selector.md","standards/context-engine.md","standards/context-packaging.md","standards/authority-matrix.md","taxonomy/session-roles.json","taxonomy/mentor-teams.json","taxonomy/specialty-matrix.json","taxonomy/people.json"],"validated":true,"selector_initialized":true}
